{
  "schema_version": "1.0",
  "requirements_text": "Сотрудник подаёт заявку на ремонт оборудования. Заявка содержит описание неисправности. Сотрудник видит свои заявки и их статус. Диспетчер видит заявки и меняет статус. Кто может удалять заявки, не определено. Реальные внешние интеграции не требуются. Список заявок отображается не более чем за 2 секунды.",
  "questions_revision": 1,
  "answers": [
    {
      "question_id": "c4f2de3a-29de-5e7d-a845-91de97bbcbf2",
      "value": "Удаление запрещено всем ролям."
    }
  ],
  "previous_requirements_artifact_id": "20000000-0000-4000-8000-000000000001",
  "analysis_rules_artifact_id": null
}
