{
  "schema_version": "1.0",
  "requirements_text": "Сотрудник подаёт заявку на ремонт оборудования. Заявка содержит описание неисправности. Сотрудник видит свои заявки и их статус. Диспетчер видит заявки и меняет статус. Кто может удалять заявки, не определено. Реальные внешние интеграции не требуются. Список заявок отображается не более чем за 2 секунды.",
  "questions_revision": 0,
  "answers": [],
  "previous_requirements_artifact_id": null,
  "analysis_rules_artifact_id": null
}
